department,number,title,unit,ge,description,prerequisite,restriction,same as,overlaps with,concurrent with,grading option,repeatability,corequisite,prerequisite or corequisite
DRAMA,10,Introduction to Theatre,4,IV,"An interactive introduction to the world of theatre that serves to develop an appreciation of theatrical arts, to establish an awareness of landmarks within the performance history, and to create an understanding of the collaborative roles and departments that exist.",,,,,,,,,
DRAMA,11,The Rock and Roll Spectacle Show,4,IV,"A thorough overview to the development and cultural significance of the Rock 'n' Roll Spectacle show. Focus on historical and recent developments of the spectacle show, trends in the aesthetics of the field, and various sub-genres.",,,,,,,,,
DRAMA,14,Performing Rock 'N' Roll,4,,"Explores major movements in the history of rock 'n' roll in terms of performance, not virtuosity necessarily of the performers as musicians, rather as performances of aesthetics in modes of embodied ideology, iconoclastic spectacle, mixed media fashion, and subcultural formation.",,,,,,,,,
DRAMA,15,Performance Now,4,IV,"Exposes students to what is most current in the world of performance and theatre.  Begins with a series of lectures on the idea of performance, and the various theories that frame it.",,Music Theatre Majors have first consideration for enrollment. Drama Majors have first consideration for enrollment.,,,,,,,
DRAMA,16,Performing Culture,4,IV,"Culture, aesthetics, and ideology (combined in the concept ""subculture"") work to fashion social identities. Using theories and methodologies of performance studies, with an emphasis on American culture, this course explores why and how culture is reinforced through performance.",,,,,,,,,
DRAMA,20A,Culture in Performance,4,IV,"A three-quarter foundation series exploring the rich depth of theatre, drama, and other genres of performance across a wide variety of worldwide forms, for performer and audience.",,,,,,,,,
DRAMA,20B,Culture in Performance,4,IV,"A three-quarter foundation series exploring the rich depth of theatre, drama, and other genres of performance across a wide variety of worldwide forms, for performer and audience.",,,,,,,,,
DRAMA,20C,Culture in Performance,4,IV,"A three-quarter foundation series exploring the rich depth of theatre, drama, and other genres of performance across a wide variety of worldwide forms, for performer and audience.",,,,,,,,,
DRAMA,30A,Acting,4,,Focuses on Stanislavski-based terminology and technique through theatre exercises and improvisation. The first part of a one-year series in basic acting technique and discipline.,,Music Theatre Majors have first consideration for enrollment. Drama Majors have first consideration for enrollment.,,,,,May be taken for credit 2 times.,,
DRAMA,30B,Acting,4,,Focuses on scene work and character development. The second part of a one-year series in basic acting technique and discipline.,DRAMA 30A,Music Theatre Majors have first consideration for enrollment. Drama Majors have first consideration for enrollment.,,,,,May be taken for credit 2 times.,,
DRAMA,30C,Acting,4,,"Focuses on monologues, auditions, callbacks, and the profession of acting. The third part of a one-year series in basic acting technique and discipline.",DRAMA 30A and DRAMA 30B,Music Theatre Majors have first consideration for enrollment. Drama Majors have first consideration for enrollment.,,,,,May be taken for credit 2 times.,,
DRAMA,34,Movement for Actors,4,,"A studio course in fundamentals of stretch, strength, and alignment; exploring spatial awareness and physical control through mime isolations, techniques, and related improvisation.",,,,,,,May be taken for credit 3 times.,,
DRAMA,35,Speech for the Theatre,4,,"An introductory course in voice and speech for actors, combining the body-based approach to voice developed by Fitzmaurice, and speech work of Knight and Thompson. Designed for the needs of actors and is not a public speaking course.",,Music Theatre Majors only. Drama Majors only.,,,,,May be repeated for credit unlimited times.,,
DRAMA,40A,Development of Drama,4,IV and VIII,"The development of Western Drama, concentrating on the drama's intellectual, social, and artistic foundations. About 10 plays and supplementary critical material are read each quarter. Greek Drama through Shakespeare.",,Music Theatre Majors have first consideration for enrollment. Drama Majors have first consideration for enrollment.,,,,,,,DRAMA 10
DRAMA,40B,Development of Drama,4,IV and VIII,"The development of Western Drama, concentrating on the drama's intellectual, social, and artistic foundations. About 10 plays and supplementary critical material are read each quarter. Restoration Drama through Ibsen.",,Music Theatre Majors have first consideration for enrollment. Drama Majors have first consideration for enrollment.,,,,,,,DRAMA 10
DRAMA,40C,Development of Drama,4,IV and VIII,"The development of Western Drama, concentrating on the drama's intellectual, social, and artistic foundations. About 10 plays and supplementary material are read each quarter. Contemporary Drama. Post Naturalistic theatre.",,Music Theatre Majors have first consideration for enrollment. Drama Majors have first consideration for enrollment.,,,,,,,DRAMA 10
DRAMA,50A,Introduction to Costume Design,4,,"Introduction to the process and procedures employed by the costume designer for the theatre. The elements of design are discussed in the context of character development, historical period, and style. Exercises extend to drawing, rendering, and investigation of human proportions.",,Music Theatre Majors only. Drama Majors only.,,,,,,,DRAMA 10
DRAMA,50B,Introduction to Scenic Design,4,,"Introduction to the principles and practice of scenic design. Weekly problems include research into various periods and styles of production with an emphasis on the conceptual idea. Perspective drawing, rendering, and model building are covered in studio exercises and assignments.",,Music Theatre Majors only. Drama Majors only.,,,,,,,DRAMA 10
DRAMA,50C,Introduction to Lighting Design,4,,"Introduction to the principles, theories, and equipment employed by the lighting designer for the stage.  Areas of investigation include history, technology, and script analysis. Detailed studio attention is given to the theory and practice of design.",,Music Theatre Majors only. Drama Majors only.,,,,,,,DRAMA 10
DRAMA,50D,Introduction to Sound Design,4,,"Principles, theories, equipment use, and terminology employed by the sound designer for the stage.  Areas of study include history, technology, and script analysis.  Focuses on the theory and practice of design.",,Music Theatre Majors only. Drama Majors only.,,,,,,,DRAMA 10
DRAMA,50E,Introduction to Stage Management,4,,"A basic study of theatrical, dance, and opera stage management practices, forms, and methods, from first script reading to closing night.  Opportunity to observe professionals at work in regional and touring situations as available.",,Music Theatre Majors only. Drama Majors only.,,,,,,,DRAMA 10
DRAMA,60,Topics in Advanced Stage Management,4,,"Nurtures a greater appreciation for the stage manager and his or her process, and supports students who are interested in pursuing a career in professional stage management.",,,,,,,May be taken for credit 3 times as topics vary.,,
DRAMA,65,Music Theatre Workshop I,2,,Basic vocal technique and characterization of musical theatre repertoire explored.,Audition required.,,,,,,May be taken for credit 2 times.,,
DRAMA,80,Directing I,4,,"Introduction to comprehensive directing process from pre-production to opening. Focus on fundamental skills: analysis, staging, action, actor coaching, and elements of design. Skills applied to scripted theatrical material. Develop a language for commenting on theatrical production. Attending and critiquing productions.",DRAMA 30A and DRAMA 30B,,,,,,,,
DRAMA,100,University Theatre,4,,Rehearsal and performance in a faculty-directed.,Audition required.,,,,,,May be repeated for credit unlimited times.,,
DRAMA,101A,Theatre Production:  Costume,1-6,,The production courses are offered to give students the opportunity to participate in departmental productions. Students engage in the production and construction of designed work as well as its applied execution during performance.,,May be taken for credit for a maximum of 24 units provided productions change.,,,,,May be taken for credit for 24 units.,,
DRAMA,101B,Theatre Production:  Scenic,1-6,,The production courses are offered to give students the opportunity to participate in departmental productions. Students engage in the production and construction of designed work as well as its applied execution during performance.,,May be taken for credit for a maximum of 24 units provided productions change.,,,,,May be taken for credit for 24 units.,,
DRAMA,101C,Theatre Production:  Lighting,1-6,,The production courses are offered to give students the opportunity to participate in departmental productions. Students engage in the production and construction of designed work as well as its applied execution during performance.,,May be taken for credit for a maximum of 24 units provided productions change.,,,,,May be taken for credit for 24 units.,,
DRAMA,101D,Theatre Production:  Stage Management,1-8,,The production courses are offered to give students the opportunity to participate in departmental productions. Students engage in the production and construction of designed work as well as its applied execution during performance.,,May be taken for credit for a maximum of 24 units provided productions change.,,,,,May be taken for credit 24 times.,,
DRAMA,101E,Theatre Production:  Audio,1-6,,The production courses are offered to give students the opportunity to participate in departmental productions. Students engage in the production and construction of designed work as well as its applied execution during performance.,,May be taken for credit for a maximum of 24 units provided productions change.,,,,,May be taken for credit for 24 units.,,
DRAMA,101S,Theatre Production: Theatre Management,1-6,,The production courses are offered to give students the opportunity to participate in departmental productions. Students engage in the production and construction of designed work as well as its applied execution during performance.,,May be taken for credit for a maximum of 24 units provided productions change.,,,,,May be taken for credit for 24 units.,,
DRAMA,103,Lectures in Dramatic Literature,4,,"Courses include Medieval and Tudor Drama, Elizabethan and Jacobean Drama, Shakespeare, Restoration and Eighteenth Century Drama, Modern British Drama, Modern American Drama, Tragedy, and Comedy.",,Drama Majors only. Music Theatre Majors only.,,,,,Unlimited as topics vary.,,
DRAMA,103W,Lectures in Dramatic Literature,4,,"Courses include Medieval and Tudor Drama, Elizabethan and Jacobean Drama, Shakespeare, Restoration and Eighteenth-Century Drama, Modern British Drama, Modern American Drama, Tragedy, and Comedy.",Satisfactory completion of the lower-division writing requirement.,Drama Majors only. Music Theatre Majors only.,,,,,Unlimited as topics vary.,,
DRAMA,109,Special Topics in Theory and Criticism,4,,"Discussion of recent major trends and ideas in critical theory, concentrating on in-depth readings and lectures in particular facets of theory and criticism: Derrida, Butler, Lacan, Deleuze, and others.",,Music Theatre Majors only. Drama Majors only.,,,,,Unlimited as topics vary.,,
DRAMA,109W,Special Topics in Theory and Criticism,4,Ib,"Discussion of recent major trends and ideas in critical theory, concentrating on in-depth readings and lectures in particular facets of theory and criticism: Derrida, Butler, Lacan, Deleuze, and others.",Satisfactory completion of the Lower-Division Writing requirement.,Music Theatre Majors only. Drama Majors only.,,,,,Unlimited as topics vary.,,
DRAMA,110,Special Topics in Classical Dramas,4,,"Designed to introduce students to various classical traditions-early Greek and Roman theatres, to be sure, but also, by way of comparison, the classical traditions of non-European cultures.",DRAMA 40A and DRAMA 40B and DRAMA 40C. Satisfactory completion of the lower-division writing requirement.,Music Theatre Majors only. Drama Majors only.,,,,,Unlimited as topics vary.,,
DRAMA,110W,Special Topics in Classical Dramas,4,Ib,"Designed to introduce students to various classical traditions-early Greek and Roman theatres, to be sure, but also, by way of comparison, the classical traditions of non-European cultures.",DRAMA 40A or DRAMA 40B or DRAMA 40C. Satisfactory completion of the lower-division writing requirement.,Music Theatre Majors only. Drama Majors only.,,,,,Unlimited as topics vary.,,
DRAMA,112,Special Topics in Early Modern and Neoclassical Theatre,4,,"Investigates aspects of European theatre and culture in the sixteenth, seventeenth, and eighteenth centuries; individual courses may focus on specific topics within this broad expanse.",Satisfactory completion of the lower-division writing requirement.,Music Theatre Majors only. Drama Majors only.,,,,,Unlimited as topics vary.,,
DRAMA,112W,Special Topics in Early Modern and Neoclassical Theatre,4,Ib,"Investigates aspects of European theatre and culture in the sixteenth, seventeenth, and eighteenth centuries; individual courses may focus on specific topics within this broad expanse.",Satisfactory completion of the lower-division writing requirement.,Music Theatre Majors only. Drama Majors only.,,,,,Unlimited as topics vary.,,
DRAMA,116,Special Topics in Nineteenth-Century Dramas,4,,"Looks at the various trends and conventions of theatres in the nineteenth century, both Euro-American and beyond, paying special attention to the culture and political milieu within which these various traditions appeared.",DRAMA 40A and DRAMA 40B and DRAMA 40C. Satisfactory completion of the lower-division writing requirement.,Music Theatre Majors only. Drama Majors only.,,,,,Unlimited as topics vary.,,
DRAMA,116W,Special Topics in Nineteenth-Century Dramas,4,Ib,"Looks at the various trends and conventions of theatres in the nineteenth century, both Euro-American and beyond, paying special attention to the culture and political milieu within which these various traditions appeared.",DRAMA 40A and DRAMA 40B and DRAMA 40C. Satisfactory completion of the Lower-Division Writing requirement.,Music Theatre Majors only. Drama Majors only.,,,,,Unlimited as topics vary.,,
DRAMA,118,Special Topics in Modern and Contemporary Drama,4,,"An investigation into the many forms and permutations of modern (1880-1945), and contemporary (since 1945) drama, paying special attention to the historical and philosophical interpretations of text and performance.",DRAMA 40A and DRAMA 40B and DRAMA 40C. Satisfactory completion of the Lower-Division Writing requirement.,Music Theatre Majors only. Drama Majors only.,,,,,Unlimited as topics vary.,,
DRAMA,118W,Special Topics in Modern and Contemporary Drama,4,Ib,"An investigation into the many forms and permutations of modern (1880-1945), and contemporary (since 1945) drama, paying special attention to the historical and philosophical interpretations of text and performance.",DRAMA 40A and DRAMA 40B and DRAMA 40C. Satisfactory completion of the lower-division writing requirement.,Music Theatre Majors only. Drama Majors only.,,,,,Unlimited as topics vary.,,
DRAMA,121,Introduction to Asian Theatre,4,,"An introduction to some of the major traditional theatrical forms and dramatic texts from India, China, and Japan.  Other than dramatic texts (in English translation), attention is also paid to theory, history, and performance styles of traditional Asian theatre.",,Drama Majors only. Music Theatre Majors only.,,,,,,,
DRAMA,122,Asian American Theatre,4,,"An introduction to the history and development of Asian American theatre and drama. Besides play analysis, special attention is also paid to the history and politics of Asian American identity and experience, as well as to aspects of theatrical performance.",DRAMA 40A and DRAMA 40B and DRAMA 40C,Drama Majors only. Music Theatre Majors only.,,,,,,,
DRAMA,123,Multicultural Theatres,4,,"A study of the history, culture, aesthetics, and literature of various traditional performing arts and their connections to the contemporary multicultural society.",,Music Theatre Majors only. Drama Majors only.,,,,,Unlimited as topics vary.,,
DRAMA,126,African American Film and Drama,4,,"A critical investigation of films and plays written by African Americans, with emphasis on dramaturgical and cinematic strategies, individual and collective representation, and the legacy of African American political struggle.",Satisfactory completion of the lower-division writing requirement.,Music Theatre Majors only. Drama Majors only.,,,,,,,
DRAMA,126W,African American Film and Drama,4,Ib,"A critical investigation of films and plays written by African Americans, with emphasis on dramaturgical and cinematic strategies, individual and collective representation, and the legacy of African American political struggle.",Satisfactory completion of the lower-division writing requirement.,Music Theatre Majors only. Drama Majors only.,,,,,,,
DRAMA,129,Advanced Topics in Performance,4,,"Addresses particular issues in theatre and performance that typically lie outside of regular course offerings. May address such issues as the theatre of the Avant Garde, performing gender, transversality and performance, body art, installation and performance art, among other topics.",,Music Theatre Majors only. Drama Majors only.,,,,,Unlimited as topics vary.,,
DRAMA,129W,Advanced Topics in Performance,4,Ib,"Addresses particular issues in theatre and performance that typically lie outside of regular course offerings. May address such issues as the theatre of the Avant Garde, performing gender, transversality and performance, body art, installation and performance art, among other topics.",Satisfactory completion of the Lower-Division Writing requirement.,,,,,,Unlimited as topics vary.,,
DRAMA,130,Intermediate Acting,4,,"Rehearsal and presentation of scenes from contemporary material. Focus on connection with scene partner, playing actions, and text analysis. Introduction to the credibility and theatricality of characterization and style.",DRAMA 30A and DRAMA 30B and DRAMA 30C with an average grade of B or better. For transfer students: one year of beginning acting with an average grade of B or better.,Drama Majors only. Music Theatre Majors only.,,,,,May be taken for credit 2 times.,,
DRAMA,132A,Writing for Performance,4,,Completion of a full-length play or its equivalent; discussion of student writing and of relevant literary texts.,Satisfactory completion of the lower-division writing requirement.,Music Theatre Majors only. Drama Majors only.,,,,,Unlimited as topics vary.,,
DRAMA,134,Studio for Advanced Movement for Actors,4,,Studio course in conditioning and partnering techniques to the practice of contact improvisation. Contact improvisation is explored and applied in scene study.,DRAMA 34. DRAMA 34 with a grade of B or better,,,,,,May be taken for credit 3 times.,,
DRAMA,135,Master Classes in Acting,1-4,,"Advanced acting in specialized areas including acting for the camera: situation comedy, commercials; auditioning and industry preparation; Shakespeare; Moliere; Chekov; improvisation; advanced movement and voice and speech for the actor; self-starting; stage combat; repertory acting, singing; comedy; clowning; and masks.",DRAMA 130. DRAMA 130 with a grade of B or better,Drama Majors only. Music Theatre Majors only.,,,,,Unlimited as topics vary.,,
DRAMA,136,Music Theatre Acting,4,,An acting class exclusive to the students in the B.F.A. in Music Theatre program.,DRAMA 30A and DRAMA 30B and DRAMA 30C,Music Theatre Majors only.,,,,,May be taken for credit 4 times.,,
DRAMA,142,Music Theatre Workshop II,4,,A workshop in audition technique and song interpretation.,Audition required.,,,,,,May be taken for credit 4 times.,,
DRAMA,143A,Music Theatre Workshop III,4,,Scene study and song repertoire examined by era for the advanced Music Theatre student. 1800s-1940.,DRAMA 142. Audition required.,,,,,,,,
DRAMA,143B,Music Theatre Workshop III,4,,Scene study and song repertoire examined by era for the advanced Music Theatre student. 1940s-1970s.,DRAMA 142. Audition required.,,,,,,,,
DRAMA,143C,Music Theatre Workshop III,4,,Scene study and song repertoire examined by era for the advanced Music Theatre student. 1970's-present.,DRAMA 142. Audition required.,,,,,,,,
DRAMA,144,Music Theatre Workshop IV,4,,A performance class concentrating on role building. Work culminates with in-class performances of abbreviated versions of musicals.,"For B.F.A. students: DRAMA 143A, DRAMA 143B, DRAMA 143C, and audition. For Drama graduate students: audition required.",Graduate students only. Music Theatre Majors only. Drama Majors only.,,,,,May be taken for credit 4 times.,,
DRAMA,145,Music Theatre Singing,1,,Private weekly voice lessons for the advanced Music Theatre student.,,Music Theatre Majors only.,,,,,May be taken for credit 9 times.,DRAMA 143A,
DRAMA,146,NYSP-Preparation,4,,Class preparation for the New York Satellite Program (NYSP) - an immersion experience in New York City for the musical theatre performer.,"Admission is by audition and the following prerequisites: DRAMA 30C and two quarters of DRAMA 148A, DRAMA 148B, or DRAMA 148C (if the 148 prerequisite is not complete at the time of auditions, student must enroll during the fall and winter quarters in the same year as the trip to New York); senior Drama majors must have successfully completed DRAMA 40C and DRAMA 120C; non-Drama majors must have sophomore standing or higher and must carefully plan their course schedule as many spring quarter classes cannot be taken while part of the NYSP.",,,,,,May be taken for credit 2 times.,,
DRAMA,148A,History of American Musical Theatre,4,,"A survey of the influential artists who produce, write, direct, and perform on America's musical stages. Surveys 1700s-1940s.",,Drama Majors only. Music Theatre Majors only.,,,DRAMA 248A.,,,,
DRAMA,148B,History of American Musical Theatre,4,,"A survey of the influential artists who produce, write, direct, and perform on America's musical stages. Surveys 1940s-1970s.",,Drama Majors only. Music Theatre Majors only.,,,DRAMA 248B.,,,,
DRAMA,148C,History of American Musical Theatre,4,,"A survey of the influential artists who produce, write, direct, and perform on America's musical stages. Surveys 1970s to present day.",,Drama Majors only. Music Theatre Majors only.,,,DRAMA 248C.,,,,
DRAMA,149,Music Proficiency for Actors,2,,"A musicianship class introducing basic musical terminology, theory, and sight singing skills.",,Drama Majors only. Music Theatre Majors only.,,,,,May be taken for credit 2 times.,,
DRAMA,150,Costume Production Techniques,4,,"Studio instruction in pattern making, draping, millinery, and construction techniques.",DRAMA 50A,Drama Majors only. Music Theatre Majors only.,,,,,Unlimited as topics vary.,,
DRAMA,157,Lighting Composition,4,,Provides an opportunity for students to pursue stage lighting composition in a studio atmosphere.  Laboratory practice includes weekly exercises in style and genre. Emphasis is placed on the realization of conceptual ideas.,DRAMA 50C,Drama Majors only. Music Theatre Majors only.,,,,,May be repeated for credit unlimited times.,,
DRAMA,158,Topics in Theatre Design,4,,"Examines the various functions of scenery and costume: locale, historical period, mood, and atmosphere, with special assignments in each area. Discussion of problems in scenic metaphors and visualization, emphasizing techniques of planning and presentation (e.g., floor plans, models, and rendering).",DRAMA 50A or DRAMA 50B,Music Theatre Majors only. Drama Majors only.,,,,,May be repeated for credit unlimited times.,,
DRAMA,159,Proseminar in Theatre Design,4,,Topics in theatre design.,,Drama Majors only. Music Theatre Majors only.,,,,,Unlimited as topics vary.,,
DRAMA,164A,History of Costume,4,,A study of the development of dress and the influence of cultural factors on clothing from the time of Egyptians to Early Baroque.,DRAMA 50A,Drama Majors only. Music Theatre Majors only.,,,,,,,
DRAMA,164B,History of Costume,4,,A study of the development of dress and the influence of cultural factors on clothing from late Baroque to World War I.,DRAMA 50A,Drama Majors only. Music Theatre Majors only.,,,,,,,
DRAMA,176,Script and Score,4,,A form and analysis seminar discussing the libretto and score of landmark musicals.,Two courses from DRAMA 148A or DRAMA 148B or DRAMA 148C.,Drama Majors only. Music Theatre Majors only.,,,,,,,
DRAMA,177,Song Repertoire,2,,"A song coaching class culminating in a song recital or showcase. Each quarter will feature a different composer, lyricist, or musical style.",,Music Theatre Majors only.,,,,,May be taken for credit 6 times.,,
DRAMA,180,Contemporary Dramatic Criticism and Theory,4,,"Reading and analysis of theories and critical approaches to contemporary theatre: Brecht, Artaud, and others who have contributed to the form and idea of the modern theatre. Writing of assigned exercises in dramatic criticism.",,Drama Majors only. Music Theatre Majors only.,,,,,Unlimited as topics vary.,,
DRAMA,180W,Contemporary Dramatic Criticism and Theory,4,Ib,"Reading and analysis of theories and critical approaches to contemporary theatre:  Brecht, Artaud, and others who have contributed to the form and idea of the modern theatre. Writing of assigned exercises in dramatic criticism.",Satisfactory completion of the lower-division writing requirement.,Drama Majors only. Music Theatre Majors only.,,,,,Unlimited as topics vary.,,
